{
  "manifest_schema_version": "1.0.0",
  "implementation_run_id": "QM2-P0-999-20260713T000000Z-0123456",
  "task_id": "QM2-P0-999",
  "parent_task_id": null,
  "title": "Example Implementation Run",
  "objective": "Demonstrate the v1 manifest contract.",
  "scope": ["Documentation example only."],
  "explicit_non_goals": ["No runtime change."],
  "repository": "example-repository",
  "repository_root": "/example/repository",
  "branch": "example-branch",
  "base_commit": "0123456789abcdef0123456789abcdef01234567",
  "result_commit": null,
  "workspace_dirty_before": false,
  "workspace_dirty_after": true,
  "unrelated_dirty_files": [],
  "source_bundle_hash": "0000000000000000000000000000000000000000000000000000000000000000",
  "git_diff_hash": "0000000000000000000000000000000000000000000000000000000000000000",
  "started_at": "2026-07-13T00:00:00Z",
  "completed_at": "2026-07-13T00:01:00Z",
  "agent_type": "codex",
  "task_status": "completed_uncommitted",
  "completion_level": "complete",
  "verification_level": "structural",
  "changed_files": ["docs/example.md"],
  "added_files": ["docs/example.md"],
  "deleted_files": [],
  "changed_symbols": [],
  "database_migrations": [],
  "api_endpoints": [],
  "schemas_changed": [],
  "config_changed": [],
  "dependencies_changed": false,
  "tests_executed": [
    {
      "command": "python3 tools/example_validator.py",
      "scope": "example structural validation",
      "status": "passed",
      "passed": 1,
      "failed": 0,
      "skipped": 0,
      "not_run": 0,
      "evidence": "Example only."
    }
  ],
  "test_results": {"status": "passed", "passed": 1, "failed": 0, "skipped": 0, "not_run": 0},
  "artifacts": [],
  "architecture_decision_refs": [],
  "component_refs": ["example.component"],
  "known_limitations": ["This is not an actual implementation run."],
  "unresolved_questions": [],
  "next_recommended_tasks": [],
  "rollback_information": "Remove the example document.",
  "frozen_architecture_compliance": "compliant",
  "security_impact": "None.",
  "data_lineage_impact": "None.",
  "report_path": "docs/example.md",
  "report_hash": "0000000000000000000000000000000000000000000000000000000000000000",
  "manifest_path": "docs/example.json",
  "manifest_payload_hash": "0000000000000000000000000000000000000000000000000000000000000000",
  "generated_context_versions": {"example": "1.0.0"},
  "corrects_run_id": null
}
